{
    "id": 9,
    "moves": [
        {
            "name": "nightmare",
            "url": "http://127.0.0.1:8000/api/v2/move/171/"
        }
    ],
    "name": "nightmare",
    "names": [
        {
            "language": {
                "name": "fr",
                "url": "http://127.0.0.1:8000/api/v2/language/5/"
            },
            "name": "Cauchemar"
        },
        {
            "language": {
                "name": "en",
                "url": "http://127.0.0.1:8000/api/v2/language/9/"
            },
            "name": "Nightmare"
        }
    ]
}
